{
    "map_name": "Cyanide-class Recon Vessel",
    "prefix": "SYN-C",
    "map_short_name": "Cyanide-class",
    "map_path": "_maps/shuttles/shiptest/voidcrew/cyanide.dmm",
    "map_id": "cyanide",
    "job_slots": {
        "Syndicate Recon Officer": {
            "outfit": "/datum/outfit/syndicate_empty/sbc/assault/captain",
            "officer": true,
            "slots": 1
        },
        "Syndicate Marine":{
            "outfit": "/datum/outfit/syndicate_empty/sbc/assault",
            "slots": 1
        }

    },
    "cost": 375,
	"disable_passwords": true
}
