{
	"map_name": "Afflictor-Class Phase Frigate",
	"prefix": "NEU",
	"map_short_name": "Afflictor-Class",
	"map_path": "_maps/shuttles/shiptest/voidcrew/afflictor.dmm",
	"map_id": "afflictor",
	"job_slots": {
		"Captain": 1,
		"Geneticist": 1,
		"Station Engineer": 1,
		"Shaft Miner": 4
	},
	"cost": 450
}
