{
	"map_name": "Starfire-class Atmospherics gasser",
	"map_short_name": "Starfire-class",
	"prefix": "NT-C",
	"map_path": "_maps/shuttles/shiptest/voidcrew/Atmosia.dmm",
	"map_id": "Atmosia",
	"job_slots": {
		"Captain": 1,
		"Atmospheric Technician": 3,
		"Security Officer": 3
    
	},
	"cost": 700
}
