{
	"map_name": "KOS Express-Class Eldritch Hijacked Freighter",
	"map_short_name": "Cultist-class",
	"map_path": "_maps/shuttles/shiptest/voidcrew/express_cultist.dmm",
	"antag_datum": "cult",
	"map_id": "express_cultist",
	"job_slots": {
		"Cultist Leader": {
			"outfit": "/datum/outfit/job/captain/western",
			"officer": true,
			"slots": 1
		},
		"Converted Foreman": {
			"outfit": "/datum/outfit/job/quartermaster/western",
			"slots": 1
		},
		"Converted Engineer": {
			"outfit": "/datum/outfit/job/engineer/hazard",
			"slots": 1
		},
		"Converted Miner": {
			"outfit": "/datum/outfit/job/miner/hazard",
			"slots": 2
		},
		"Cultist": {
			"outfit": "/datum/outfit/job/assistant",
			"slots": 3
		}
	}
}
