{
	"map_name": "Mechaton-class Robotics Production Facility",
	"map_short_name": "Mechaton-class",
	"prefix": "NEU",
	"map_path": "_maps/shuttles/shiptest/voidcrew/mechaton.dmm",
	"map_id": "mechaton",
	"job_slots": {
		"Facility Director": {
			"outfit": "/datum/outfit/job/rd",
			"officer": true,
			"slots": 1
		},
		"Roboticist": {
			"outfit": "/datum/outfit/job/roboticist",
			"slots": 2
		},
		"Ship Engineer": {
			"outfit": "/datum/outfit/job/engineer",
			"slots": 2
		},
		"Mech Pilot": {
			"outfit": "/datum/outfit/job/assistant",
			"slots": 2
		}
	},
	"cost": 350
}